{"schemaVersion":"1.0.0","kind":"replay-bundle","identity":"sha256:2c78c5bc973192967b8afe66e5276fac6c5f6f6261522b476d606958b12a9335","runManifestIdentity":"sha256:6666666666666666666666666666666666666666666666666666666666666666","receiptIdentities":["sha256:7777777777777777777777777777777777777777777777777777777777777777"],"contractIdentities":["sha256:8888888888888888888888888888888888888888888888888888888888888888"],"createdAt":"2026-10-07T05:00:00Z"}
